{
  "version": "ruhroh_suite_v1",
  "id": "ruhroh-productivity",
  "title": "Ruhroh Productivity",
  "suiteVersion": "1.0.0",
  "description": "Productivity app workflows that test whether agents can deliver usable local tools with stateful user interactions.",
  "scenarioIds": [
    "grocery-budget-planner",
    "vite-sprint-planner",
    "nextjs-task-board"
  ],
  "scenarioVersions": {
    "grocery-budget-planner": "1.0.0",
    "vite-sprint-planner": "1.0.0",
    "nextjs-task-board": "1.0.0"
  },
  "methodology": {
    "minRuns": 10,
    "aggregationUnit": "scenario_adapter",
    "reportPolicy": "pass_rate_ci_pass_at_k",
    "confidenceLevel": 0.95,
    "retryPolicy": "Count agent, build, and evaluator failures unless the run manifest proves an external infrastructure outage."
  },
  "governance": {
    "owner": "ruhroh-maintainers",
    "createdAt": "2026-07-07",
    "updatedAt": "2026-07-07",
    "changelog": [
      "1.0.0: Initial productivity suite covering budget planning, sprint planning, and local task-board workflows."
    ],
    "acceptanceCriteria": [
      "Each scenario must require a user-visible workflow, not only static page generation.",
      "Each scenario must include persistence, editing, filtering, or comparable repeated-use behavior.",
      "Evaluation guidance must prefer final app behavior over implementation layout."
    ],
    "contaminationReview": "Scenarios should avoid public benchmark prompts with known canonical repos or solution diffs.",
    "rewardHackingReview": "Review every productivity task for hard-coded happy paths, superficial UI completion, and rubric language that can be satisfied without repeated-use workflow behavior.",
    "reviewChecklist": [
      "Confirm each scenario requires editing, filtering, persistence, or comparable repeated-use behavior.",
      "Confirm evaluator evidence covers at least one realistic user workflow, not just page presence.",
      "Confirm bundled assets and prompts do not point to public canonical implementations."
    ],
    "deprecationPolicy": "Deprecated scenarios remain listed until a replacement suiteVersion is published."
  }
}
